{
  "$schema": "../../../../schemas/battle-trait.schema.json",
  "id": "trait_weak_physical",
  "label": "物理弱点",
  "flavorText": "殴ればすべて解決する。だが、殴られた方はどうなるんだ。",
  "kind": "trait",
  "draftable": false,
  "effect": [
    {
      "op": "elementAffinity",
      "element": "physical",
      "affinity": "weak"
    }
  ]
}
