{
  "$schema": "../../../../schemas/battle-trait.schema.json",
  "id": "trait_pierce_zenith",
  "label": "貫通の真髄",
  "flavorText": "包装が開けれない時、真っ先に考えるのは指を刺して破くことだ。",
  "kind": "trait",
  "unlockCondition": {
    "category": "pierce",
    "points": 20
  },
  "effect": [
    {
      "op": "effectBoost",
      "element": "special",
      "rate": 0.3
    }
  ]
}
